{
  "schema_version": "mesh-matrix-config-v0",
  "run_name": "gmsh-synthetic-matrix",
  "generator": {
    "name": "gmsh",
    "version": "auto",
    "executable": "../../Test_chialuoi/gmsh-4.15.2-Windows64/gmsh.exe",
    "parameters": {
      "algorithm": 5,
      "random_seed": 1
    }
  },
  "domains": [
    {
      "name": "inclined-plane",
      "kind": "synthetic_inclined_plane",
      "width": 1000.0,
      "height": 1000.0,
      "base_elevation": 100.0,
      "slope_x": 0.01,
      "slope_y": 0.005
    },
    {
      "name": "v-valley",
      "kind": "synthetic_v_valley",
      "width": 1000.0,
      "height": 1000.0,
      "base_elevation": 100.0,
      "downstream_slope": 0.01,
      "cross_slope": 0.02
    },
    {
      "name": "radial-bowl",
      "kind": "synthetic_radial_bowl",
      "width": 1000.0,
      "height": 1000.0,
      "base_elevation": 100.0,
      "curvature": 0.00004
    },
    {
      "name": "y-drainage",
      "kind": "synthetic_y_drainage",
      "width": 1000.0,
      "height": 1000.0,
      "base_elevation": 100.0,
      "downstream_slope": 0.005,
      "cross_slope": 0.02
    }
  ],
  "refinements": [
    {"name": "coarse", "target_edge": 500.0},
    {"name": "medium", "target_edge": 250.0},
    {"name": "fine", "target_edge": 125.0}
  ],
  "crs": "EPSG:32649",
  "coordinate_units": "m",
  "state_units": {
    "volume": "m3",
    "depth": "m"
  },
  "output_root": "../mesh_runs"
}
